{
  "schemaVersion": "codex-blind-review-v1",
  "candidateId": "CQ-PHYSICS-3006",
  "reviewerTaskId": "01a0956e-644c-7d11-9772-8cc443cf5aa8",
  "derivedAnswer": "A",
  "optionTruthTable": {
    "A": true,
    "B": false,
    "C": false,
    "D": false
  },
  "conditionsSufficient": true,
  "ambiguityFound": false,
  "syllabusAligned": true,
  "difficultyAssessment": "medium",
  "caseNecessary": true,
  "counterexampleAttempted": true,
  "verificationEvidence": [
    "向左初速取负：(3×5+2×(-1))/5=13/5=2.6 m/s。仅 A 正确。",
    "已逐项对照 A/B/C/D；真值表只标记由题干独立推出的选项，未采用任何题面或元数据自报答案。"
  ],
  "verdictBeforeReveal": "pass",
  "reasonCodes": [],
  "reviewedAt": "2026-09-15T18:46:01.1890259+08:00"
}
