{
  "schemaVersion": "codex-blind-review-v1",
  "candidateId": "CQ-PHYSICS-3008",
  "reviewerTaskId": "01a0956e-644c-7d11-9772-8cc443cf5aa8",
  "derivedAnswer": "C",
  "optionTruthTable": {
    "A": false,
    "B": false,
    "C": true,
    "D": false
  },
  "conditionsSufficient": true,
  "ambiguityFound": false,
  "syllabusAligned": true,
  "difficultyAssessment": "medium",
  "caseNecessary": true,
  "counterexampleAttempted": true,
  "verificationEvidence": [
    "12 Ω 与 4 Ω 并联等效 3 Ω，再串联 2 Ω 得 5 Ω；总电流 15/5=3 A。仅 C 正确。",
    "已逐项对照 A/B/C/D；真值表只标记由题干独立推出的选项，未采用任何题面或元数据自报答案。"
  ],
  "verdictBeforeReveal": "pass",
  "reasonCodes": [],
  "reviewedAt": "2026-09-15T18:46:01.1890259+08:00"
}
