{
  "schemaVersion": "codex-blind-review-v1",
  "candidateId": "CQ-PHYSICS-1004",
  "reviewerTaskId": "01a0a477-1ae5-7880-93e0-6f44c2e06294",
  "derivedAnswer": "D",
  "optionTruthTable": {
    "A": false,
    "B": false,
    "C": false,
    "D": true
  },
  "conditionsSufficient": true,
  "ambiguityFound": false,
  "syllabusAligned": true,
  "difficultyAssessment": "basic",
  "caseNecessary": true,
  "counterexampleAttempted": true,
  "verificationEvidence": [
    "Uniform speed is |56 m|/7 s=8 m/s. Only D matches; A, B, and C differ numerically.",
    "The English localization is not publication-ready: it begins with a lowercase sentence fragment and repeatedly uses ungrammatical constructions such as \"The result supports\" followed by a bare verb."
  ],
  "verdictBeforeReveal": "reject",
  "reasonCodes": [
    "EN_LOCALIZATION_UNGRAMMATICAL"
  ],
  "reviewedAt": "2026-09-15T09:54:16.101Z"
}
