{
  "schemaVersion": "codex-blind-review-v1",
  "candidateId": "CQ-MATH-1008",
  "reviewerTaskId": "01a0a477-1ae5-7880-93e0-6f44c2e06294",
  "derivedAnswer": "C",
  "optionTruthTable": {
    "A": false,
    "B": false,
    "C": true,
    "D": false
  },
  "conditionsSufficient": true,
  "ambiguityFound": false,
  "syllabusAligned": true,
  "difficultyAssessment": "basic",
  "caseNecessary": true,
  "counterexampleAttempted": true,
  "verificationEvidence": [
    "14^3=14*14*14=196*14=2744. Therefore C is true; A and B are off by +1 and -1, and D has the wrong sign."
  ],
  "verdictBeforeReveal": "pass",
  "reasonCodes": [],
  "reviewedAt": "2026-09-15T09:54:16.101Z"
}
