{
  "schemaVersion": "codex-blind-review-v1",
  "candidateId": "CQ-MATH-0004",
  "reviewerTaskId": "pilot-30-independent-blind-review",
  "derivedAnswer": "D",
  "optionTruthTable": {
    "A": false,
    "B": false,
    "C": false,
    "D": true
  },
  "conditionsSufficient": true,
  "ambiguityFound": false,
  "syllabusAligned": true,
  "difficultyAssessment": "basic",
  "caseNecessary": false,
  "counterexampleAttempted": true,
  "verificationEvidence": [
    "f'(x)=-3x^2-4x-1，f'(2)=-12-8-1=-21；仅D成立。",
    "检查定义域、符号与所有四个选项后，只有一个选项满足题干。"
  ],
  "verdictBeforeReveal": "pass",
  "reasonCodes": [],
  "reviewedAt": "2026-09-15T09:29:16.058Z"
}
