{
  "schemaVersion": "codex-blind-review-v1",
  "candidateId": "CQ-CHEMISTRY-0012",
  "reviewerTaskId": "pilot-30-independent-blind-review",
  "derivedAnswer": "D",
  "optionTruthTable": {
    "A": false,
    "B": false,
    "C": false,
    "D": true
  },
  "conditionsSufficient": true,
  "ambiguityFound": false,
  "syllabusAligned": true,
  "difficultyAssessment": "medium",
  "caseNecessary": true,
  "counterexampleAttempted": true,
  "verificationEvidence": [
    "n(H+)−n(OH-)=0.00200000−0.000600000=0.00140000 mol；总体积=0.0350000 L。",
    "过量[H+]=0.0400000 mol/L，pH=1.3979，与唯一选项吻合；反查其余选项均不满足物料衡算。"
  ],
  "verdictBeforeReveal": "pass",
  "reasonCodes": [],
  "reviewedAt": "2026-09-15T09:29:16.058Z"
}
