{
  "schemaVersion": "codex-blind-review-v1",
  "candidateId": "CQ-CHEMISTRY-2009",
  "reviewerTaskId": "01a0a489-caf4-75e3-8c3a-a92ea323f53c",
  "derivedAnswer": "A",
  "optionTruthTable": {
    "A": true,
    "B": false,
    "C": false,
    "D": false
  },
  "conditionsSufficient": true,
  "ambiguityFound": false,
  "syllabusAligned": true,
  "difficultyAssessment": "basic",
  "caseNecessary": true,
  "counterexampleAttempted": true,
  "verificationEvidence": [
    "稀释后 [OH-]=0.01×20/500=4.0×10^-4 mol/L，pOH=3.39794，25°C 下 pH=10.60206，约为 10.6，只有 A 符合。",
    "反算 pH 10.6 得 pOH 3.4、[OH-]≈3.98×10^-4 mol/L，与物料衡算吻合。"
  ],
  "verdictBeforeReveal": "pass",
  "reasonCodes": [],
  "reviewedAt": "2026-09-15T18:11:48.7966294+08:00"
}
