{
  "schemaVersion": "codex-blind-review-v1",
  "candidateId": "CQ-MATH-0015",
  "reviewerTaskId": "pilot-30-independent-blind-review",
  "derivedAnswer": "C",
  "optionTruthTable": {
    "A": false,
    "B": false,
    "C": true,
    "D": false
  },
  "conditionsSufficient": true,
  "ambiguityFound": false,
  "syllabusAligned": true,
  "difficultyAssessment": "basic",
  "caseNecessary": false,
  "counterexampleAttempted": true,
  "verificationEvidence": [
    "斜率=(-1-(-3))/(5-0)=2/5；分母非零，符号、倒数和偏移干扰项均排除。",
    "检查定义域、符号与所有四个选项后，只有一个选项满足题干。"
  ],
  "verdictBeforeReveal": "pass",
  "reasonCodes": [],
  "reviewedAt": "2026-09-15T09:29:16.058Z"
}
