{
  "schemaVersion": "codex-blind-review-v1",
  "candidateId": "CQ-CHEMISTRY-0003",
  "reviewerTaskId": "pilot-30-independent-blind-review",
  "derivedAnswer": "C",
  "optionTruthTable": {
    "A": false,
    "B": false,
    "C": true,
    "D": false
  },
  "conditionsSufficient": true,
  "ambiguityFound": false,
  "syllabusAligned": true,
  "difficultyAssessment": "medium",
  "caseNecessary": true,
  "counterexampleAttempted": true,
  "verificationEvidence": [
    "[H+]=0.1×20/400=0.00500000 mol/L；pH=-lg[H+]=2.3010，按选项精度舍入。",
    "反查其余三个选项对应的氢离子浓度，均不等于稀释后的浓度；体积单位在比值中相消。"
  ],
  "verdictBeforeReveal": "pass",
  "reasonCodes": [],
  "reviewedAt": "2026-09-15T09:29:16.058Z"
}
