{
  "schemaVersion": "codex-blind-review-v1",
  "candidateId": "CQ-PHYSICS-2002",
  "reviewerTaskId": "01a0a489-caf4-75e3-8c3a-a92ea323f53c",
  "derivedAnswer": "B",
  "optionTruthTable": {
    "A": false,
    "B": true,
    "C": false,
    "D": false
  },
  "conditionsSufficient": true,
  "ambiguityFound": false,
  "syllabusAligned": true,
  "difficultyAssessment": "basic",
  "caseNecessary": true,
  "counterexampleAttempted": true,
  "verificationEvidence": [
    "匀速直线运动：v=18 m/3 s=6 m/s，只有 B 符合。",
    "反查四项与 3 s 相乘，仅 B 给出 18 m；单位一致，求速度大小无方向歧义。"
  ],
  "verdictBeforeReveal": "pass",
  "reasonCodes": [],
  "reviewedAt": "2026-09-15T18:11:48.7966294+08:00"
}
